ProductGroupID,ProductGroupName,Category,SubCategory,Description,DateCreated,DateUpdated,IsActive,CreatedBy,UpdatedBy,ImageURL
1,Door,Increase,Work,If sometimes baby traditional if happen relationship this every.,2024-03-28,2024-04-01,False,Jason Ballard,Michelle Daniels,https://placekitten.com/152/656
2,Seem,Suggest,Prepare,Camera minute quality one cost fight ago situation figure positive adult performance.,2022-08-17,2022-12-21,False,Blake Rodriguez,Taylor Keller,https://placekitten.com/400/554
3,Game,Computer,Hold,Series senior agree PM society personal education quality animal.,2022-12-01,2023-06-08,False,Tyler Watkins,Christine Holmes,https://placekitten.com/678/608
4,Theory,Half,Same,Herself story hour want book present responsibility system collection though test director owner catch west.,2023-07-04,2024-03-30,True,Maria Glover,Catherine Robinson,https://placekitten.com/1005/640
5,Successful,Better,Among,Fear factor paper statement until son admit human large must forward mission item.,2024-03-20,2024-06-16,False,Charles Sims,Robert Carter,https://picsum.photos/514/669
6,Government,Among,Wear,For tough talk realize ability during home despite front according other seek.,2024-02-25,2024-05-20,False,Lori Wilson,Daniel Mathews,https://dummyimage.com/23x133
7,Great,Future,Read,Mr effect difficult month today ball single show cost important thank already just simply race.,2023-04-21,2024-05-14,False,Darren Arellano,Amy Waller,https://dummyimage.com/641x65
8,While,Per,Option,Company arm difference relationship term order report remember star onto in step also would information.,2022-11-10,2023-05-14,True,Marissa Guzman,Sarah Ochoa,https://placekitten.com/928/563
9,Land,Try,Performance,Instead discuss range major wind game soldier actually husband raise maybe.,2024-03-11,2024-04-04,False,Dana Jennings,Joshua Dyer,https://dummyimage.com/39x370
10,Participant,Especially,Have,Throw likely pattern family task front protect.,2023-06-24,2023-10-27,True,Thomas Rosales,Steven Arnold,https://dummyimage.com/832x955
11,Upon,Myself,Teach,Do them tonight finish nature current physical image future light pay wish space book public.,2023-04-08,2023-10-22,True,James Gonzalez,Michelle Kennedy,https://picsum.photos/5/730
12,Role,Read,Drug,Same wrong customer idea know defense parent couple message suddenly people.,2022-08-26,2023-11-11,False,Suzanne Wilcox,Laura Montoya,https://picsum.photos/67/632
13,Movement,Receive,Would,Care middle modern someone artist wrong information build head great their start.,2022-09-15,2022-12-30,False,Darius Lee,Tiffany Harmon,https://dummyimage.com/181x343
14,Surface,Behavior,Something,Since watch energy threat state ahead send result become area work money.,2022-08-06,2023-11-05,False,Amber Nichols,Tara Shah,https://picsum.photos/846/652
15,Model,Clear,Business,Field let tell sign see language wind behavior house job medical course.,2024-04-24,2024-05-02,False,Jeffery Allison,Tonya Steele,https://dummyimage.com/430x982
16,Lay,Physical,Spend,Street my recognize system third author power again yourself five American mission.,2023-06-11,2023-11-26,False,Bryan Chavez,Michele Brown,https://placekitten.com/348/550
17,Issue,Option,Speak,Reveal meeting which sound where movie whether often new.,2024-02-08,2024-04-06,True,Corey Benton,Gregory Clark,https://picsum.photos/278/455
18,Part,Federal,Wish,Organization power contain edge heavy loss clear.,2022-07-01,2023-03-14,False,Jeanne Jimenez,Todd Welch,https://picsum.photos/778/600
19,Fear,When,Piece,With moment radio require maintain him action right question prepare drug imagine long.,2023-01-20,2023-12-31,False,Scott Branch,Wendy Lambert,https://dummyimage.com/254x23
20,Because,Would,Window,Of can phone traditional whole visit order teach anyone despite huge discuss view section reach.,2024-01-24,2024-03-29,True,Kevin Compton,David Mcdonald,https://picsum.photos/401/377
